{
  "schema": "xcodebuildmcp.output.build-settings",
  "schemaVersion": "2",
  "didError": false,
  "error": null,
  "data": {
    "artifacts": {
      "workspacePath": "example_projects/iOS_Calculator/CalculatorApp.xcworkspace",
      "scheme": "CalculatorApp"
    },
    "entries": [
      {
        "key": "Build settings for action build and target CalculatorApp:",
        "value": ""
      },
      {
        "key": "ACTION",
        "value": "build"
      },
      {
        "key": "AD_HOC_CODE_SIGNING_ALLOWED",
        "value": "NO"
      },
      {
        "key": "AGGREGATE_TRACKED_DOMAINS",
        "value": "YES"
      },
      {
        "key": "ALLOW_BUILD_REQUEST_OVERRIDES",
        "value": "NO"
      },
      {
        "key": "ALLOW_TARGET_PLATFORM_SPECIALIZATION",
        "value": "NO"
      },
      {
        "key": "ALTERNATE_GROUP",
        "value": "<GROUP>"
      },
      {
        "key": "ALTERNATE_MODE",
        "value": "u+w,go-w,a+rX"
      },
      {
        "key": "ALTERNATE_OWNER",
        "value": "<USER>"
      },
      {
        "key": "ALTERNATIVE_DISTRIBUTION_WEB",
        "value": "NO"
      },
      {
        "key": "ALWAYS_EMBED_SWIFT_STANDARD_LIBRARIES",
        "value": "NO"
      },
      {
        "key": "ALWAYS_SEARCH_USER_PATHS",
        "value": "NO"
      },
      {
        "key": "ALWAYS_USE_SEPARATE_HEADERMAPS",
        "value": "NO"
      },
      {
        "key": "APPLICATION_EXTENSION_API_ONLY",
        "value": "NO"
      },
      {
        "key": "APPLY_RULES_IN_COPY_FILES",
        "value": "NO"
      },
      {
        "key": "APPLY_RULES_IN_COPY_HEADERS",
        "value": "NO"
      },
      {
        "key": "APP_SHORTCUTS_ENABLE_FLEXIBLE_MATCHING",
        "value": "YES"
      },
      {
        "key": "ARCHS",
        "value": "arm64"
      },
      {
        "key": "ARCHS_BASE",
        "value": "arm64"
      },
      {
        "key": "ARCHS_STANDARD",
        "value": "arm64"
      },
      {
        "key": "ARCHS_STANDARD_32_64_BIT",
        "value": "armv7 arm64"
      },
      {
        "key": "ARCHS_STANDARD_32_BIT",
        "value": "armv7"
      },
      {
        "key": "ARCHS_STANDARD_64_BIT",
        "value": "arm64"
      },
      {
        "key": "ARCHS_STANDARD_INCLUDING_64_BIT",
        "value": "arm64"
      },
      {
        "key": "ARCHS_UNIVERSAL_IPHONE_OS",
        "value": "armv7 arm64"
      },
      {
        "key": "ASSETCATALOG_COMPILER_APPICON_NAME",
        "value": "AppIcon"
      },
      {
        "key": "ASSETCATALOG_COMPILER_GENERATE_SWIFT_ASSET_SYMBOL_EXTENSIONS",
        "value": "YES"
      },
      {
        "key": "ASSETCATALOG_COMPILER_GLOBAL_ACCENT_COLOR_NAME",
        "value": "AccentColor"
      },
      {
        "key": "ASSETCATALOG_FILTER_FOR_DEVICE_MODEL",
        "value": "<DEVICE_MODEL>"
      },
      {
        "key": "ASSETCATALOG_FILTER_FOR_DEVICE_OS_VERSION",
        "value": "<OS_VERSION>"
      },
      {
        "key": "ASSETCATALOG_FILTER_FOR_THINNING_DEVICE_CONFIGURATION",
        "value": "MacFamily20,1"
      },
      {
        "key": "AUTOMATICALLY_MERGE_DEPENDENCIES",
        "value": "NO"
      },
      {
        "key": "AUTOMATION_APPLE_EVENTS",
        "value": "NO"
      },
      {
        "key": "AVAILABLE_PLATFORMS",
        "value": "android appletvos appletvsimulator driverkit freebsd iphoneos iphonesimulator linux macosx none openbsd qnx watchos watchsimulator webassembly xros xrsimulator"
      },
      {
        "key": "BUILD_ACTIVE_RESOURCES_ONLY",
        "value": "YES"
      },
      {
        "key": "BUILD_COMPONENTS",
        "value": "headers build"
      },
      {
        "key": "BUILD_DIR",
        "value": "<HOME>/Library/Developer/Xcode/DerivedData/CalculatorApp-<HASH>/Build/Products"
      },
      {
        "key": "BUILD_LIBRARY_FOR_DISTRIBUTION",
        "value": "NO"
      },
      {
        "key": "BUILD_ONLY_KNOWN_LOCALIZATIONS",
        "value": "NO"
      },
      {
        "key": "BUILD_ROOT",
        "value": "<HOME>/Library/Developer/Xcode/DerivedData/CalculatorApp-<HASH>/Build/Products"
      },
      {
        "key": "BUILD_STYLE",
        "value": ""
      },
      {
        "key": "BUILD_VARIANTS",
        "value": "normal"
      },
      {
        "key": "BUILT_PRODUCTS_DIR",
        "value": "<HOME>/Library/Developer/Xcode/DerivedData/CalculatorApp-<HASH>/Build/Products/Debug-iphoneos"
      },
      {
        "key": "BUNDLE_CONTENTS_FOLDER_PATH_deep",
        "value": "Contents/"
      },
      {
        "key": "BUNDLE_EXECUTABLE_FOLDER_NAME_deep",
        "value": "MacOS"
      },
      {
        "key": "BUNDLE_EXTENSIONS_FOLDER_PATH",
        "value": "Extensions"
      },
      {
        "key": "BUNDLE_FORMAT",
        "value": "shallow"
      },
      {
        "key": "BUNDLE_FRAMEWORKS_FOLDER_PATH",
        "value": "Frameworks"
      },
      {
        "key": "BUNDLE_PLUGINS_FOLDER_PATH",
        "value": "PlugIns"
      },
      {
        "key": "BUNDLE_PRIVATE_HEADERS_FOLDER_PATH",
        "value": "PrivateHeaders"
      },
      {
        "key": "BUNDLE_PUBLIC_HEADERS_FOLDER_PATH",
        "value": "Headers"
      },
      {
        "key": "CACHE_ROOT",
        "value": "<XCODE_CACHE_ROOT>"
      },
      {
        "key": "CCHROOT",
        "value": "<XCODE_CACHE_ROOT>"
      },
      {
        "key": "CHMOD",
        "value": "/bin/chmod"
      },
      {
        "key": "CHOWN",
        "value": "chown"
      },
      {
        "key": "CLANG_ANALYZER_NONNULL",
        "value": "YES"
      },
      {
        "key": "CLANG_ANALYZER_NUMBER_OBJECT_CONVERSION",
        "value": "YES_AGGRESSIVE"
      },
      {
        "key": "CLANG_CACHE_FINE_GRAINED_OUTPUTS",
        "value": "YES"
      },
      {
        "key": "CLANG_COVERAGE_MAPPING",
        "value": "YES"
      },
      {
        "key": "CLANG_CXX_LANGUAGE_STANDARD",
        "value": "gnu++20"
      },
      {
        "key": "CLANG_ENABLE_EXPLICIT_MODULES",
        "value": "YES"
      },
      {
        "key": "CLANG_ENABLE_MODULES",
        "value": "YES"
      },
      {
        "key": "CLANG_ENABLE_OBJC_ARC",
        "value": "YES"
      },
      {
        "key": "CLANG_ENABLE_OBJC_WEAK",
        "value": "YES"
      },
      {
        "key": "CLANG_MODULES_BUILD_SESSION_FILE",
        "value": "<HOME>/Library/Developer/Xcode/DerivedData/ModuleCache.noindex/Session.modulevalidation"
      },
      {
        "key": "CLANG_PROFILE_DATA_DIRECTORY",
        "value": "<HOME>/Library/Developer/Xcode/DerivedData/CalculatorApp-<HASH>/Build/ProfileData"
      },
      {
        "key": "CLANG_WARN_BLOCK_CAPTURE_AUTORELEASING",
        "value": "YES"
      },
      {
        "key": "CLANG_WARN_BOOL_CONVERSION",
        "value": "YES"
      },
      {
        "key": "CLANG_WARN_COMMA",
        "value": "YES"
      },
      {
        "key": "CLANG_WARN_CONSTANT_CONVERSION",
        "value": "YES"
      },
      {
        "key": "CLANG_WARN_DEPRECATED_OBJC_IMPLEMENTATIONS",
        "value": "YES"
      },
      {
        "key": "CLANG_WARN_DIRECT_OBJC_ISA_USAGE",
        "value": "YES_ERROR"
      },
      {
        "key": "CLANG_WARN_DOCUMENTATION_COMMENTS",
        "value": "YES"
      },
      {
        "key": "CLANG_WARN_EMPTY_BODY",
        "value": "YES"
      },
      {
        "key": "CLANG_WARN_ENUM_CONVERSION",
        "value": "YES"
      },
      {
        "key": "CLANG_WARN_INFINITE_RECURSION",
        "value": "YES"
      },
      {
        "key": "CLANG_WARN_INT_CONVERSION",
        "value": "YES"
      },
      {
        "key": "CLANG_WARN_NON_LITERAL_NULL_CONVERSION",
        "value": "YES"
      },
      {
        "key": "CLANG_WARN_OBJC_IMPLICIT_RETAIN_SELF",
        "value": "YES"
      },
      {
        "key": "CLANG_WARN_OBJC_LITERAL_CONVERSION",
        "value": "YES"
      },
      {
        "key": "CLANG_WARN_OBJC_ROOT_CLASS",
        "value": "YES_ERROR"
      },
      {
        "key": "CLANG_WARN_QUOTED_INCLUDE_IN_FRAMEWORK_HEADER",
        "value": "YES"
      },
      {
        "key": "CLANG_WARN_RANGE_LOOP_ANALYSIS",
        "value": "YES"
      },
      {
        "key": "CLANG_WARN_STRICT_PROTOTYPES",
        "value": "YES"
      },
      {
        "key": "CLANG_WARN_SUSPICIOUS_MOVE",
        "value": "YES"
      },
      {
        "key": "CLANG_WARN_UNGUARDED_AVAILABILITY",
        "value": "YES_AGGRESSIVE"
      },
      {
        "key": "CLANG_WARN_UNREACHABLE_CODE",
        "value": "YES"
      },
      {
        "key": "CLANG_WARN__DUPLICATE_METHOD_MATCH",
        "value": "YES"
      },
      {
        "key": "CLASS_FILE_DIR",
        "value": "<HOME>/Library/Developer/Xcode/DerivedData/CalculatorApp-<HASH>/Build/Intermediates.noindex/CalculatorApp.build/Debug-iphoneos/CalculatorApp.build/JavaClasses"
      },
      {
        "key": "CLEAN_PRECOMPS",
        "value": "YES"
      },
      {
        "key": "CLONE_HEADERS",
        "value": "NO"
      },
      {
        "key": "CODESIGNING_FOLDER_PATH",
        "value": "<HOME>/Library/Developer/Xcode/DerivedData/CalculatorApp-<HASH>/Build/Products/Debug-iphoneos/CalculatorApp.app"
      },
      {
        "key": "CODE_SIGNING_ALLOWED",
        "value": "YES"
      },
      {
        "key": "CODE_SIGNING_REQUIRED",
        "value": "YES"
      },
      {
        "key": "CODE_SIGN_CONTEXT_CLASS",
        "value": "XCiPhoneOSCodeSignContext"
      },
      {
        "key": "CODE_SIGN_IDENTITY",
        "value": "Apple Development"
      },
      {
        "key": "CODE_SIGN_INJECT_BASE_ENTITLEMENTS",
        "value": "YES"
      },
      {
        "key": "CODE_SIGN_STYLE",
        "value": "Automatic"
      },
      {
        "key": "COLOR_DIAGNOSTICS",
        "value": "NO"
      },
      {
        "key": "COMBINE_HIDPI_IMAGES",
        "value": "NO"
      },
      {
        "key": "COMPILATION_CACHE_CAS_PATH",
        "value": "<HOME>/Library/Developer/Xcode/DerivedData/CompilationCache.noindex"
      },
      {